### ISSUE TITLE
[feature request] -4 option for zypper, like curl and wget

### ISSUE THREAD

**Issue by zenzhong8383** [openSUSE/zypper#49]
I think it could be a workaround for a DNS resolving issue.

Issue details:

I received "Error message: Failed to connect to 2001:67c:2178:8::13: Network is unreachable" frequently when I set Tumbleweed as repository before, "curl --head download.opensuse.org" showed the same error.

I found my router at home has an issue on DNS resolving: ipv6 addresses were returned for both A and AAAA query, result from tcpdump:
22:50:45.925896 IP 192.168.0.2.58627 > 192.168.0.1.domain: 38640+ A? download.opensuse.org. (39)
22:50:45.925907 IP 192.168.0.2.58627 > 192.168.0.1.domain: 21267+ AAAA? download.opensuse.org. (39)
22:50:45.927134 IP 192.168.0.1.domain > 192.168.0.2.58627: 38640 1/0/0 AAAA 2001:67c:2178:8::13 (67)
22:50:46.337089 IP 192.168.0.1.domain > 192.168.0.2.58627: 21267 1/0/0 AAAA 2001:67c:2178:8::13 (67)

"curl -4 --head download.opensuse.org" works, since it tried other nameserver in /etc/resolv.conf when it got wrong ipv4 address, and the second nameserver works.

"-4" option could be a solution, I tried to add "--ipv4" in .curlrc before, but it doesn't apply to zypper; then I modified /etc/resolv.conf to fix it, it works, though.

And I found some other guys want to get this option too, or "-6".

**Comment by mlandres** [comment]
There's no zypper option, but with libzypp-16.4.4 you can set `ZYPP_MEDIA_CURL_IPRESOLVE=4` in the environment to force the libzypp curl backend to resolve names to IPv4 addresses only. (`=6` to force IPv6 only). This will work for zypper as well as for YAST and PackageKit.
